{
  "version": "v1",
  "enforcement_mode": "fail_closed",
  "core_roots": [
    "src",
    "docs",
    "extensions",
    "roadmaps",
    "ci",
    ".codex",
    "AGENTS.md",
    "CHANGELOG.md",
    "README.md",
    "pyproject.toml",
    "smoke_test.py",
    ".gitignore",
    ".env.example"
  ],
  "catalog_roots": ["schemas", "policies", "registry", "workflows", "orchestrator", "packs", "capabilities"],
  "workspace_root_required": true,
  "external_write_allowlist": ["evidence", ".cache/script_budget", ".cache/ws_*"],
  "notes": [
    "Core and catalog writes are blocked unless CORE_UNLOCK=1.",
    "Workspace root is the default write target; allowlist is limited to generated outputs."
  ]
}
